<?xml version="1.0" encoding="UTF-8"?>

<vnx_dynamips xmlns:xsi="http://www.w3.org/2001/XMLSchema-instance" 
     xsi:noNamespaceSchemaLocation="/usr/share/xml/vnx/dynamips.xsd"> 

  <global>
    <sparsemem>true</sparsemem>
    <ghostios>false</ghostios>
    <hw>
       <slot id="0">NM-4E</slot>
       <slot id="1">NM-4T</slot>
       <console_base port="1000"/>
     </hw>

  </global>


  <vm name="R1">
     <!--conf>/home/jrodriguez/R1.txt</conf-->
     <hw>
       <chassis>c3640</chassis>
       <slot id="0">NM-4E</slot>
       <slot id="1">NM-4T</slot>
       <console port="920"/>
     </hw>
     <login password="cosas"/>
     <login user="jack_sparrow" password="perla_negra"/>
     <login user="caribe" password="piratas"/>
     <enable password="xxxx"/>
  </vm>

  <vm name="R2">
	<conf>/home/jrodriguez/R2.conf</conf>
	<login password="cosas"/>
  </vm>
    <vm name="R3">
  	</vm>

</vnx_dynamips>